date,title,content,score,url,num_comments
1718654066.0,Can malware access your bank and steal your money? It feels unlikely.,"I usually read on reddit how links can be dangerous. That's true but i also read how they gonna steal all your money. This part seems little exaggerate. Like with random link in email i would download malware that's gonna steal all my money from bank account? I would understand ""scam call"" where the victim would send the money or stealing credit card info. But i don't understand malware getting access to bank. Posts about that feels little unrealistic.

Let me explain:

1. In my country every bank has mobile banking app that's used for approving payments and access. You always need phone. Every bank has 2FA. Its default. You must have smartphone. (There are actually special accounts for people without mobile but those are limited in options. You have lower limits. Not every bank has this type of account. Its not standart. You need to specifically ask bank for that.) There is no SMS login in normal bank. You always need to accept login in mobile app with fingerprint.
2. Every time you want send money or change settings you need to accept it on your app with fingerprint. If you want for example send money to ten people you need to accept it ten times with your fingerprint.
3. In case you lost your access you need to go to the bank personally. There is no easy ""i forgot password option."" (Actually nowadays at least in my bank, there is option to get access to bank from home but you need to record your voice, record your face, record your id card, pretty long process. Also I'm not sure if this option would work in case of different phone)
4. If you buy new phone you could transfer your bank. But you need access to your old phone, otherwise point three apply.
5. You have only few attempts with password. Otherwise locked account and point three apply.
6. There are other security measure. Like app have access to your location and if anything unusual happen your bank call you. (It actually happened to me, i just wanted to buy something with debit card but it was foreign website and bank called me if i really want to approve my payment.)

Those are pretty standart points. Its not my bank specific. Even my dad, ten years ago when there wasn't mobile banking. He still had some physical key with totp. And he still needed to use that number every time he wanted to buy anything or change anything in his bank account.

Its seems extremely unlikely. Especially if you are not some high value target. I personally heard about three people who lost money. Two times it was stolen credit card info and one time scam call. Never stolen bank account, but from some news on reddit. It sound like there are malwares that attack bank accounts. I never studied security. **I'm just curious if those post really exaggerate or I'm missing something.** Because attacker would need to get access to phone with some malware, steal your fingerprint and then redirect the call from bank. Those steps seems possible but really unlikely. I just don't get it.

Sorry if that's wrong subreddit. I don't know where to ask, but i thinking about that for past days.

",0,https://www.reddit.com/r/cybersecurity/comments/1di79nd/can_malware_access_your_bank_and_steal_your_money/,24
1718652689.0,"AppSec - Critical Vuln ID'd on API, Workarounds?","We have a team deploying a new application in the next month. After a pentest was run, we detected a Critical vuln on an API related to a Weak SSL Cipher. Guidance is for them to disable weak ciphers. The team tells us that once deployed, this API will be disabled as it was only needed for deployment.

Any thoughts on risks of accepting this vulnerability and not remediating it since the API will be disabled post-launch?",4,https://www.reddit.com/r/cybersecurity/comments/1di6pxa/appsec_critical_vuln_idd_on_api_workarounds/,6
1718651890.0,What first certifications would not only be good for HR but also skill?,"UPDATE: 
So I managed to have the opportunity to get all these certs Cloud+, sec+, net+ a+, Linux+ and CCNA. Though I just discovered I also have the options of
 -Microsoft Certified: Azure Developer
Associate  
-Microsoft Certified: Azure Developer
Associate  with industry certification 
-AWS Certified Developer
-AWS Certified SysOps Administrator

So net+, linux+, a+ are combined and can’t be individually switched. But the others can [cloud+,sec+,CCNA] now I understand that I should take the first three being I know nothing of it haha THO being ahead of the game would y’all say get the 6 certs or cloud+,sec+,CCNA and one of the aws / Microsoft certs? ",54,https://www.reddit.com/r/cybersecurity/comments/1di6egk/what_first_certifications_would_not_only_be_good/,93
1718648444.0,"Vulnerability Summary for the Week of June 10, 2024 | CISA",,1,https://www.cisa.gov/news-events/bulletins/sb24-169,0
1718647844.0,"House, Senate defense bills OK Cyber Force",,9,https://www.scmagazine.com/brief/house-senate-defense-bills-ok-cyber-force,4
1718647760.0,Cops cuff 22-year-old Brit suspected of being Scattered Spider leader,,53,https://www.theregister.com/AMP/2024/06/17/scattered_spider_arrest/,11
1718645757.0,"As an average Joe, what might be the most shocking about Cybersecurity that everyone doesn't know?",,280,https://www.reddit.com/r/cybersecurity/comments/1di3xz5/as_an_average_joe_what_might_be_the_most_shocking/,264
1718645245.0,Any leadership programme actually worth it?,"Is there any leadership programme that will actually make a difference in your career progression? I have all the credentials and degrees i need w/ 5 YOE, but I'm wondering if any leadership courses will make a difference pr grab attention on a resume?",0,https://www.reddit.com/r/cybersecurity/comments/1di3qp3/any_leadership_programme_actually_worth_it/,7
1718642627.0,What are some of the latest tricks that Social Engineering hackers have tried doing recently?,,26,https://www.reddit.com/r/cybersecurity/comments/1di2o1f/what_are_some_of_the_latest_tricks_that_social/,40
1718640061.0,Memory Forensic Tools Stack,"In this Memory Forensic blog, we mentioned some of the essential tools used in memory forensics, check them out!

I am going to update it soon, as there are some additional helpful tools which can be used in certain scenarios - you will not expect some of them, so stay tuned :)

Let me know what other tools you are using in memory forensics too \^\^",2,https://www.reddit.com/r/cybersecurity/comments/1di1n2z/memory_forensic_tools_stack/,3
1718639676.0,What do people think about all of these new “AI”-based ids systems?,"A number of companies are bringing these things to market, suggesting their products have low rates of false alarms and they’re able to pick up a lot of different suspicious activity and worse.",13,https://www.reddit.com/r/cybersecurity/comments/1di1hdw/what_do_people_think_about_all_of_these_new/,29
1718639537.0,Shodan and cobaltstrike ,,2,https://medium.com/@inteldalal/part-1-digging-into-asns-for-threat-hunting-cobalt-strike-3c1c9326354d,0
1718638696.0,Is Anaconda a known security risk now?,"It is not infrequent that the changes rolled out by Corporate leave us baffled wondering wtf they are thinking. The last one: amongst other things, Anaconda is now 100% banned. It must be erased from all PCs and access to its website is blocked too. Full damnatio memoriae.

...If only we didn't have a whole department doing data science and machine learning?

So, does anyone know if there is a credible reason for this? We have a meeting with Business at the end of the week where we will have to illustrate the coming changes, and I fully expect a thunderstorm, so I would like to have some concrete facts to expose...

  
EDIT: it is unlikely to be a licensing issue. We already have a process for this, licensed software can be installed if the projects pay for the license; unlicensed software removed until a license is purchased is business as usual. A total prohibition of a software is definitely unusual and typically only happens for security reasons.",28,https://www.reddit.com/r/cybersecurity/comments/1di13f5/is_anaconda_a_known_security_risk_now/,23
1718636536.0,Security awareness training for developers?,"	
Do you know of any courses, books, or other resources that train developers on cybersecurity and instill a healthy sense of paranoia?

I'm looking for something focused on topics like handling credentials, protecting their machines, avoiding phishing, etc, rather than on building secure applications (like the OWASP-10).

I have been trained with KnowB4 in the past, but they are for a much wider, non-technical audience.",2,https://www.reddit.com/r/cybersecurity/comments/1di085y/security_awareness_training_for_developers/,7
1718636009.0,Gov Contractor Advice Needed,"Hey yall I made a long post yesterday but saw it was deleted without any notice of why, so I'm gonna try reposting it while redacting some information. 

For background I am about a year and a half out of my bachelors degree and am currently employed as a Reverse Engineer contractor for a three letter agency in the Washington DC area. I make 120k currently with national average raise rates yearly. 

Recently the government agency where I am employed notified me that if a job posting with them were to open up that they would ""direct hire"" me at my same salary and job title. The only issue was that they were unsure when (or if) a posting would open ""soon"". As it were put to me, it could take months or it could take years. I'm trying to assess which route is better long term, federal (starting at a high grade) vs contractor. I understand government jobs pay less and my salary would not experience the rapid growth I've seen in the past, but the security and the retirement benefits I understand are top notch and ive been a little sick of not being fully included in job related actions due to my status as a contractor and not a full employee. I was curious if other folks have any insight on either route. Thanks in advance!",4,https://www.reddit.com/r/cybersecurity/comments/1di00j6/gov_contractor_advice_needed/,7
1718635372.0,Best Security Awareness Training Platforms,"What are the best security awareness training platforms in terms of content and ease of use. 

Is KnowBe4 the number 1? ",2,https://www.reddit.com/r/cybersecurity/comments/1dhzrot/best_security_awareness_training_platforms/,7
1718634856.0,Best certifications ,"Hi guys! I've been working as cyber security consultant for almost 2 years now, I've a very standard salary and I work in fully remote so I can't complain that much, but I start to feel a bit stuck. I would like to take a certification and then find a different job, to take my career into the next level and to find the right motivation to improve my skills because I don't know very much honestly. I've started in a very entry-level position and I still do very simple stuff in my company, like vulnerability assessments or helping my collegues in penetration tests by testing some vulnerabilties with the help of automatic tools like Qualys and Burp Suite. What do you recommend for someone at my level and with this type of experience? Thanks in advance! ",1,https://www.reddit.com/r/cybersecurity/comments/1dhzkli/best_certifications/,0
1718633347.0,(Forbes) Google Chrome Will Track You For The Next 200 Days—Then It May Get Worse,,17,https://www.forbes.com/sites/zakdoffman/2024/06/16/google-chrome-tracking-on-windows-android-iphone-for-200-more-days/,1
1718633232.0,ScriptBlock Smuggling: Spoofing PowerShell Security Logs and Bypassing AMSI Without Reflection or Patching,,2,https://www.linkedin.com/pulse/scriptblock-smuggling-spoofing-powershell-security-logs-bypassing-pg67c/?trackingId=oKuFfc9uS92rrXuThRAfCw%3D%3D,0
1718632545.0,Holes drilled through laptops - pics/story?,"Dear Blue and Read Team redditors, I am failing to find \_one\_ or \_the\_ story and pictures about how someone drilled holes through a laptop, purportedly in specific places, to destroy specific chips/parts on the motherboard. 

Does anyone have links? I'm doing a bit about travel security, they would be handy.",0,https://www.reddit.com/r/cybersecurity/comments/1dhyoic/holes_drilled_through_laptops_picsstory/,8
1718629720.0,Hackers Detail How They Allegedly Stole Ticketmaster Data From Snowflake,,145,https://www.wired.com/story/epam-snowflake-ticketmaster-breach-shinyhunters/,23
1718628329.0,Is changing domain considered bad when it comes to pentesting,"I am network security engineer from India with 10+ yrs of experience, I have been studying and to find a pen-testing or cybersecurity job but one thing I noticed is majority of time my profile is being rejected stating that I don't have relevant experience.

I am OSCP certified, done lots of HTB and other CTFs,Pretty much aware about tools being used for pentesting, aware about the process even if its something new i can learn.

From OS/networking side I have experience with network,firewall,active directory,antivirus,IPS etc.

I am really disappointed by getting rejection only because few recruiters think I dont have any pentesting skills or relevant experience and few recruiters think my CTF, self studies and Offsec training experience is not sufficient.

Am i doing any mistake by trying to change my domain?

Whether experience in other domain don't have any value at all,As far as I know to be a good pentester you should know about all aspects of network but HRs dont care about such things.?

Am it too old for domain change now, I am in mid 30s..?",27,https://www.reddit.com/r/cybersecurity/comments/1dhx6ql/is_changing_domain_considered_bad_when_it_comes/,25
1718627929.0,How difficult is it to spoof a phone number?,I use MFA for most of my website with secondary auth going to my mobile device. I read somewhere that there is a way to spoof my number on a different phone and receive my SMS messages. Is this true and how complex is this?,5,https://www.reddit.com/r/cybersecurity/comments/1dhx239/how_difficult_is_it_to_spoof_a_phone_number/,10
1718626941.0,Bypassing Okta’s Passwordless MFA: Technical Analysis and Detection,,3,https://www.rezonate.io/blog/bypassing-oktas-passwordless-mfa-technical-analysis-and-detection/,0
1718619576.0,Do you read those Cybersec thoughtfluencer in substack? Are they really good?,"Like those Ventures in Sec, TDLRsec type of blogs",0,https://www.reddit.com/r/cybersecurity/comments/1dhupsl/do_you_read_those_cybersec_thoughtfluencer_in/,1
1718616484.0,Best API Security,"Hello! I am working on a personal project for practice with development. I have a Minecraft server that interacts with my API. Currently I added no type of security (anyone with the url will get the data). 

What is the best type of method to use here as if this was a real world case? Ideally I don’t want the user/pass hard coded into the plugin as in worse case if the plugin is stolen they now have the credentials.  

I was thinking IP white listing but I am not sure if that is too weak for security? 

While playing with ChatGPT it’s suggestion was to generate an API token and store it in the SQL table, but I thought it was odd that it wanted to have the token auto refresh when used, my theory is you’d want a token to expire and generate a new one incase a hacker guesses the token since it’s not changing often?",1,https://www.reddit.com/r/cybersecurity/comments/1dhtzmo/best_api_security/,1
1718612098.0,What certs are important in Germany? ,"Hi guys,

I’m working as a dev and I’m trying to transition into more cyber security oriented role in time. 
I was thinking about doing certs, but I browsed a ton of various job offers, and they’re usually not required. I live in Germany. 
Does anyone knows anything more about it? Is CompTIA not a thing in Germany? Are there any other, more respected certs to take, maybe more German oriented, like perhaps from TÜV? 
What would you recommend to someone like me? 

Thanks in advance for any answers. ",2,https://www.reddit.com/r/cybersecurity/comments/1dhszm1/what_certs_are_important_in_germany/,1
1718611130.0,USA -> EU Job Resources ,"Looking for any advice/resources for finding jobs as an American in Europe. Would ideally work for US company remotely but I have seen requirements that require you to live in NA etc… 

I would be looking for 7+ years exp GRC/Security Analyst/ Consulting positions. I have a Bachelors degree, SEC+ and CISSP. Would be happy to work on-site for EU companies of course but I figure US would pay better. I assume I would need to apply for work VISA/blue card/ digital nomad VISAs before I begin the interview process. 

Country is not of utmost importance but ideally Italy/France/Netherlands. I have done some brief research via job boards common in America but they seem fairly bare whereas I have heard of some expats/digital nomads who do my goal on here. Wonder if it’s a networking thing or if there are better job posting sites for EU specifically. Lastly would I really be qualified as sought after/skilled worker?",1,https://www.reddit.com/r/cybersecurity/comments/1dhsrc2/usa_eu_job_resources/,2
1718594160.0,"Hobby project in cyber security, to get going ?","I am in mid 40's working as an individual contributor. Sick of rat race and office politics. More importantly, feel sad that I have not been able to achieve anything meaningful in life. So,I am thinking of doing some hobby project with no expectations. With such a low entry barrier, I know its hard to monetise. At least, it will keep me occupied and I will learn something.  Anyone else in the same boat and tried something?. It will be of great help, if you could share your experience. ( PS: I am not asking for any specific ideas here. I have to admit, I hate the heavy usage of marketing/hype in cyber security, and also the fact that its hard to keep one up to date in this field)  
",0,https://www.reddit.com/r/cybersecurity/comments/1dhohj0/hobby_project_in_cyber_security_to_get_going/,0
1718580599.0,Feeling Underpaid in Cybersecurity Consulting – Advice Needed!,"
Hey everyone,

Intro: Im a pentester from india having 3+ years of experience. I do pentest on all applications like web mobile network thick client etc etc, i do bug bounty as well.

I need some advice and perspective. I'm currently working in cybersecurity consulting and have over 3 years of experience. Despite this, I'm only earning around 9 LPA (Lakhs Per Annum). Meanwhile, I see my friends with just 2 years of experience making close to 20 LPA in similar roles.

I'm starting to feel really undervalued and unsure about my next steps. Have any of you been in a similar situation? What did you do to bridge the pay gap? Any tips on negotiating a better salary or finding higher-paying opportunities in the field?

Thanks in advance for your insights!
",0,https://www.reddit.com/r/cybersecurity/comments/1dhkcb6/feeling_underpaid_in_cybersecurity_consulting/,4
1718578052.0,Hard to study,"I really love red teaming and hacking but i find it hard to stay motivated and to keep myself studying.

I feel like if i dont study every single day then i will never make it, so whenever i take a break I feel awful

I find it hard to play any game because i feel like im wasting time when i should be studying


Furthermore I feel like im getting too old to do hacking whenever i see younger people talk about it and show their stuff (im 20) 

Is this normal? Any suggestions to make myself study?",0,https://www.reddit.com/r/cybersecurity/comments/1dhjhes/hard_to_study/,14
1718557410.0,Cybersecurity entry level jobs EU,"For the people that work in the eu, I plan to study cybersec at ETH Zurich in switzerland. How is the job progression in the eu?


 I've heard that in the US you need atleast 5 years of experience for an internship or entry level job (/s)",1,https://www.reddit.com/r/cybersecurity/comments/1dhc2cu/cybersecurity_entry_level_jobs_eu/,0
1718553428.0,Data scientist in the cybersecurity domain - is it feasible?,"The company I work with has an opening for a Data Scientist/Data Engineer in the Cybersecurity team. I have a degree in Mathematics, have been working with data analytics for some years (some basic modelling involved, including text analytics, some outlier detection, but nothing extremely sophisticated) and I'm considering to apply.

  
Since I would not want to make a move that's obviously unreasonable to people with domain experience, I have the following questions:

1. Is doing data science or at least more advanced data analytics in the cybersec domain even feasible or is the hiring manager just trying to sound cool and everything is likely handled within specified cybersec software (e.g. SIEM software)?
2. Would you be able to advise any questions that would serve as ""bullshit detectors""?

",1,https://www.reddit.com/r/cybersecurity/comments/1dhan1m/data_scientist_in_the_cybersecurity_domain_is_it/,2
1718550630.0,Seeking Help with DDoS Mitigation for Streaming Platform Using Cloudflare and Custom Rules,"Hello everyone,

I'm seeking advice and support from this community regarding persistent DDoS attacks on our streaming platform. Our site hosts a variety of content, including movies, series, animes, eBooks, and live sports streams.

**Situation Overview:**

* **Platform:** Our platform is built on Next.js and hosted on a root server. We use Cloudflare for CDN and security, leveraging Cloudflare Workers to deliver content from Backblaze B2 buckets.
* **Duration of Attacks:** We've been experiencing DDoS attacks for the past six months, typically occurring every 1-2 weeks.
* **Attack Pattern:** Attacks generally last between 0.5 to 2 hours. Recently, they have coincided with our live streams of the Euro Championship 2024 football games, previously targeting our most active times.
* **Type of Attacks:** We are facing both volumetric and application-layer attacks.
* **Targets:** The primary targets include:
   1. [`webpage.com/crew/page/*`](http://webpage.com/crew/page/*)
   2. [`webpage.com/_next/image`](http://webpage.com/_next/image)
   3. [`webpage.com/`](http://webpage.com/)

**Current Security Measures:**

* **WAF and CDN:** We are using Cloudflare’s proxy for website security and content delivery.
* **Custom Rules:** Here are the custom rules we have implemented to mitigate the attacks. They are partially effective, blocking about half of the requests during an attack. For instance, during a recent attack with 37 million requests, 19 million were blocked.

**Custom Rules:**

1. **Country-based Blocking:Action:** BlockplaintextCopy code (ip.geoip.continent in {""AF"" ""AN"" ""SA"" ""T1"" ""OC""} or  [ip.geoip.country](http://ip.geoip.country) in {""AF"" ""AG"" ""AW"" ""BS"" ""BH"" ""BD"" ""BB"" ""BZ"" ""BM"" ""BT"" ""BN"" ""KH"" ""KY"" ""CN"" ""CR"" ""US"" ""CU"" ""DM"" ""DO"" ""ID"" ""AS"" ""KR"" ""NL"" ""EC"" ""SV"" ""GD"" ""GP"" ""GT"" ""HT"" ""HN"" ""IN"" ""ID"" ""IR"" ""IQ"" ""JM"" ""JP"" ""JO"" ""KZ"" ""KP"" ""KR"" ""KW"" ""KG"" ""LA"" ""LB"" ""MY"" ""MV"" ""MQ"" ""MN"" ""MM"" ""NP"" ""NI"" ""OM"" ""PK"" ""PS"" ""PA"" ""PH"" ""PR"" ""QA"" ""VC"" ""SA"" ""SG"" ""LK"" ""SY"" ""TW"" ""TJ"" ""TH"" ""TL"" ""TT"" ""TM"" ""AE"" ""UZ"" ""VN"" ""VI"" ""NL"" ""YE"" ""XX"" ""EG""}  and ip.geoip.asnum in {8075 213230 35540 16276 20860 396982 136907 55933 396319 55990 133478 58519 202053 200350 24940})  
2. **Blocking Unwanted Access to Specific Paths:Action:** BlockplaintextCopy code http.request.uri.path eq ""/\_next/image""  and not http.referer contains ""mekobre.com""  
3. **Blocking Undefined Requests:Action:** BlockplaintextCopy code http.request.uri.path contains ""/tvshow/undefined"" or http.request.uri.path contains ""/movie/undefined"" or http.request.uri.path contains ""/undefined"" or http.request.uri.path eq ""/assets/avatars/undefined.png"" or http.request.full\_uri contains ""\`undefined\`"" or http.request.full\_uri contains ""undefined"" or http.request.full\_uri contains ""'undefined'"" or http.request.uri.path contains ""/publisher/ads-D-2.png"" or http.request.uri.path contains ""/publisher/ads-D-3.png"" or http.request.uri.path contains ""/publisher/ads-M-1.png"" or http.request.uri.path contains ""/publisher/ads-M-2.png"" or http.request.uri.path contains ""/publisher/ads-M-3.png"" or http.request.uri.path contains ""/publisher/ads-M-4.png"" or http.request.uri.path contains ""/publisher/ads-D-1.png"" or http.request.uri.path contains ""/api/movies/"" or http.request.uri.path contains ""/api/movies?id=undefined"" or http.request.uri.path contains ""undefined"" or http.request.full\_uri contains ""undefined"" or http.request.uri.path contains ""1769"" or http.request.full\_uri contains ""1769"" or http.request.uri.path contains ""/favicon.ico""  

**Current Team Setup:** Our team is small, comprising two developers, two product owners, and two content creators/sales representatives. Being a startup, the attacks seem aimed at hindering our growth.

**Request for Assistance:** We are looking for:

1. Recommendations for additional or improved WAF rules.
2. Tips on modifying our existing rules to be more effective.
3. Any templates or examples of custom rules that have worked well for others in similar situations.
4. General advice on enhancing our DDoS protection and mitigation strategies.

Your expertise and any assistance you can provide would be greatly appreciated. Thank you in advance for your support!",0,https://www.reddit.com/r/cybersecurity/comments/1dh9n58/seeking_help_with_ddos_mitigation_for_streaming/,1
1718543464.0,Risk management tool,"I am looking for a risk management tool. I need a tool to track, follow-up update and report on the set of risks I am managing. I m looking for something efficient either free, opensource or not. Please help",1,https://www.reddit.com/r/cybersecurity/comments/1dh7a7u/risk_management_tool/,0
