date,title,content,score,url,num_comments
1718623940.0,Notorious cyber gang UNC3944 attacks vSphere and Azure,,6,https://www.theregister.com/2024/06/17/unc3944_scattered_spider_tactics_change/,0
1718623631.0,Hackers Exploit Legitimate Websites to Deliver BadSpace Windows Backdoor - RedPacket Security,,9,https://www.redpacketsecurity.com/hackers-exploit-legitimate-websites-to-deliver-badspace-windows-backdoor/,0
1718612694.0,Critical Security Vulnerability CVE-2024-3912 (CVSS 9.8) Hits ASUS Routers,,21,https://securityonline.info/critical-security-vulnerability-cve-2024-3912-hits-asus-routers/,0
1718599753.0,Volunteer in Cybersecurity in the Philippines.,Is there any ngo that accept volunteers to work in stuff like cybersecurity?,0,https://www.reddit.com/r/cybersecurity/comments/1dhq11t/volunteer_in_cybersecurity_in_the_philippines/,2
1718597809.0,Are organisations fined in the case of a zero-day attack?,"Exactly what the title suggests. In the case of a zero-day attack on an organisation (which I know is very rare), if PII or SPII is compromised, does the organisation still face fines and penalties?
",18,https://www.reddit.com/r/cybersecurity/comments/1dhpiji/are_organisations_fined_in_the_case_of_a_zeroday/,13
1718526563.0,Creating LinkedIn honeypot profiles for corporate security purposes,"I'm currently managing several cybersecurity projects, and we've been encountering a troubling trend where attackers are using LinkedIn to breach our client's systems. Here are some issues we've been facing:

* Fake recruiters: Impersonators posing as recruiters trying to gather information about our internal systems, presumably to identify vulnerabilities.
* Poaching attempts: Real recruiters persistently attempting to get advance knowledge of future resignations to then try to cold call us offering their services with resumes of potential replacements.
* Market intelligence firms: They offer seemingly attractive assignments (e.g., $500/hour) to get our employees to reveal trade secrets. This is against the employment contract employees sign. We need to know who they are to send cease and desist letters.
* Salespeople: Adding multiple employees to extract small pieces of information, which they then piece together.
* Interview candidates: Trying to get staff to divulge interview questions or methodologies.

Unfortunately, banning staff from using LinkedIn isn't a feasible solution. On the other hand, continuing as is has already led to incidents like phishing attacks and ransomware directly tied to the LinkedIn information harvesting.

We're considering setting up honeypot accounts to draw these malicious actors in, allowing us to profile and do reconnaissance on them. However, we're uncertain about the best way to implement this or if there are other effective solutions.

Has anyone dealt with similar issues? What strategies or tools have you found effective in countering these malicious activities? Any advice on setting up honeypot accounts or alternative methods for monitoring and mitigating these threats would be greatly appreciated!",4,https://www.reddit.com/r/cybersecurity/comments/1dh34cz/creating_linkedin_honeypot_profiles_for_corporate/,4
1718548961.0,Are cybersec competitions only red-teaming?,"Not sure if this is the correct sub for this since I've observed it's mostly for industry folk, but I'm heading to college and my college has a cybersec competition team. I want to get into the competitive side of cybersec for fun. However, I am mostly finding CTFs, bug bounties and things like that as recommendations for practice. Do we do any blue-teaming in these events? I'm not that keen on pentesting and things like that, so if it's only CTF challenges or something I'd prefer dropping it early.",1,https://www.reddit.com/r/cybersecurity/comments/1dh9240/are_cybersec_competitions_only_redteaming/,1
1718552621.0,TI workflow for in-house SOC?,"Hi everyone,

Our in-house SOC team has grown quite a bit, and I'm starting to think about implementing a meaningful Threat Intel workflow. Any tips and tricks? Links to research and guides? Thanks in advance.",1,https://www.reddit.com/r/cybersecurity/comments/1dhacno/ti_workflow_for_inhouse_soc/,0
1718580355.0, A Newbie's Idea on Reuse-Protected Refresh Token Rotation. ,"Hi everyone,

New to cybersecurity! I'm learning about authentication and stumbled upon refresh tokens. [Auth0's article](https://auth0.com/blog/refresh-tokens-what-are-they-and-when-to-use-them/#Refresh-Token-Rotation) mentioned ""refresh token rotation,"" which intrigued me. It seems like the basic idea is keeping track of used tokens to invalidate them on reuse.

However, wouldn't a constantly growing list of used tokens be inefficient? Here's an idea:

* **Database:** Stores nonces (random, unique values) and counts (initially zero).
* **Token Generation:** Encrypt the current count and a random nonce.
* **Token Verification:** Decrypt the token to retrieve the nonce.
   * If the nonce isn't found, the token is invalid (discard).
   * If the count in the token matches the table's count, the token is valid:
      * Increment the table's count.
      * Generate a new token with the updated count (rotation).
   * If the counts differ, the token is invalid (remove nonce & count).

Is this a good approach for refresh token rotation?",1,https://www.reddit.com/r/cybersecurity/comments/1dhk9jn/a_newbies_idea_on_reuseprotected_refresh_token/,0
1718590240.0,Help - Report Writing,"hi everyone,

I have just come into a new role. I have been asked to improve my report writing skills. Can anyone help with any courses or resources that I can look at? Hoping to get any guidance I can.",1,https://www.reddit.com/r/cybersecurity/comments/1dhnbve/help_report_writing/,3
1718583080.0,"First Cert test soon, am I ready?","Hello,

I am studying for security + right now and my exam is Tuesday but I am unsure if I am ready and had a few questions.

- I get an 85% ( highest score was. 90%) on the comptia certmaster practice exams regularly, but I have taken 6 of them and am worried I am only getting that score because I see a lot of recurring questions.

- how similar is the actual exam to the certmaster practice tests?

- what other website has valid practice exams that I can take to see if I am ready?

- some questions on the practice exams are really obvious and easy answers revealed just in the question. Does the actual exam have question like that as well?

Thanks for the help",13,https://www.reddit.com/r/cybersecurity/comments/1dhl5bj/first_cert_test_soon_am_i_ready/,12
1718582411.0,"Mentorship Monday - Post All Career, Education and Job questions here!","This is the weekly thread for career and education questions and advice. There are no stupid questions; so, what do *you* want to know about certs/degrees, job requirements, and any other general cybersecurity career questions? Ask away!

Interested in what other people are asking, or think your question has been asked before? Have a look through prior weeks of content - though we're working on making this more easily searchable for the future.",22,https://www.reddit.com/r/cybersecurity/comments/1dhkxcn/mentorship_monday_post_all_career_education_and/,132
1718577481.0,"Those of you working remote, are you within driving distance?","Those of you working remote, are you required to go into the office so you have to remain within driving distance? Just curious if you could get hired on at a major company, but be elsewhere in the country. As an example, obtain a good job in DC, but live in West Virginia. HCOL job, LCOL state.",61,https://www.reddit.com/r/cybersecurity/comments/1dhja5l/those_of_you_working_remote_are_you_within/,95
1718575092.0,How much in your daily life are you actually working!? ,From someone who has no idea of CS other than some YouTube vids and Reddit… do you truly have free time vs a 9-5? Idk if that’s the correct question to ask for what I’m looking for but I’m wanting to get into a field that would create more opportunities for family time and decent money! ,166,https://www.reddit.com/r/cybersecurity/comments/1dhigdk/how_much_in_your_daily_life_are_you_actually/,236
1718574841.0,Learning paths tips,"Tips on hands-on learning

Hi,
I am a software engineer who is curious on the cybersecurity space, specially offensive security. I have been watching videos and doing some research on Kali tools, HackTheBox and others. I was curious if anyone did a more hands-on practical approach to learning (which would be helpful since that is how I have learned most stuff on my engineering career) that could give me some tips?

My end goal is to get some understanding to hopefully run some bug bounties (money or not we’ll see later on, I know it is not particularly easy to monetize it), and who knows, if I get very into it potentially steering towards cybersecurity for my career. 

Anything helps!",7,https://www.reddit.com/r/cybersecurity/comments/1dhid6f/learning_paths_tips/,3
1718564272.0,I've been looking at disputed CVEs: is it better safe than sorry for vulnerabilities relying on user misuse of packages?,"I come across many disputed CVEs that claim a given vulnerability is only present when say a user does something that is ""known to be insecure"", like entering a password through a CLI parameter option or a buffer overflow if they don't call the initialize and delete function on a C package.

I'm very curious on where the line is on this for things that are bogus vs valid. On one hand there are instances of this that are the nature of languages, like C memory management or not using parameters for SQL calls in a language that allows strings. But at some point, is it valid to say they should not be giving users this option in the first place?

Would love any resources to read up on.",16,https://www.reddit.com/r/cybersecurity/comments/1dhejkg/ive_been_looking_at_disputed_cves_is_it_better/,5
1718569830.0,Does Windows Runtime Security (RASP or eBPF equivalent) exist?,"Hello fellow security engineers,

I was doing some research this weekend and I seem to be struggling to find a solution for Windows runtime security.  Our environment is composed of different types of compute: Windows Ec2, Linux Ec2, EKS, and lambda functions. 

Right now, our cloud security program uses Snyk as our ""left side"" - preventative security layer, by deploying scanners within the CICD pipeline to prevent vulnerabilities from being introduced to the environment. We also run Wiz as our ""middle"" - observability layer to detect misconfigurations and vulnerabilities across our cloud estate. Finally, for the ""right side"" - protection layer, I'd like to deploy a series of different runtime security tools to block malicious activity after something is deployed and running. 

Wiz has a runtime sensor for both Kubernetes and Linux OS, but doesn't have anything for Windows OS (yet?). So, I'm trying to find something to fill this gap. However, I can't seem to find a modern ""runtime security"" tool for Windows OS (EC2) instances other than what I would consider old school anti-malware. Does anything like a RASP or eBPF-like tool exist for Windows? I know eBPF is Linux specific, that's what I'm saying ""ePBF-like"". 

If something like what I'm describing doesn't exist, what would the community recommend? Is something like Cylance good enough?

I appreciate the communities assistance with this!

Thanks.",1,https://www.reddit.com/r/cybersecurity/comments/1dhgkbo/does_windows_runtime_security_rasp_or_ebpf/,0
1718570386.0,Triaged data and sent it to wrong client… it gets worse,"I’m a security analyst and I totally sent data to the wrong client. I’m at an ethical dilemma right now bc instead of fixing the mistake right away I deleted the ticket even though the client still received an email. I admit I panicked and tried to resolve the mistake my own way but instead I believe I made it worse by doing this. I honestly think I’m going to lose my job over this given the current climate with the client right now and how they do not see the value in our services. 

Separately, I recently sent a wrong hostname to a client who called it out and I know this seems similar but honestly what I did now is way worse and I feel awful about it. 

Honestly this a series of unfortunate events that happened within the last month and I feel like a complete moron. I do not think this is my best work and know this is not something I regularly do.

I would like to send this information to my management team and I most likely will and will reach out to the client letting them know but any advice from someone with the same experience would be great 😔",1,https://www.reddit.com/r/cybersecurity/comments/1dhgrof/triaged_data_and_sent_it_to_wrong_client_it_gets/,3
1718564016.0,"Did the attempt to enforce TLS gone wrong way, making private keys centralised and therefore less secure? Imagine a data leak of CF keys? Or, targeted Man in the Middle made easier creating false sense of security. ",,0,https://www.certic.info/ssl2020.php,11
1718562924.0,Ask r/CyberSecurity: Place to find info and details on specific attacks?,"Is there a place (website, Forum, disccord, etc) where it's possible to find more information on specific hacks of sites/companies? 

For example, recently there was an attack on a semi-big web hotel company in my country. The attack that took down all its customers' sites (ransomware). But the company has not published anything technical on the attack itself (attack vector, vulnerabilities used, timeline, if any known group was behind it, and so on). And I want to know the details. So - is there a place where the attackers typically go and claim the credit and perhaps talk about how they did it?

Cheers",7,https://www.reddit.com/r/cybersecurity/comments/1dhe2ei/ask_rcybersecurity_place_to_find_info_and_details/,4
1718560735.0,What You Get After Running an SSH Honeypot for 30 Days,,331,https://blog.sofiane.cc/ssh_honeypot/,43
1718557527.0,Are there cyber security business owners on this platform?,"Hi there guys,

So I'd like to introduce myself on this subreddit and am looking forward to becoming a part of the community.

To begin with, I am a freelance writer, with a background in Computer Science. Over the years, I have worked with clients across various industries to create content in the form of blogs and articles but recently I have begun to understand that I have a strong interest and passion for tech and cyber security related topics.

I hopped on for two purposes:
One being, engaging with like minded individuals in the community.

And the second one is where I am particularly interested in collaborating with business owners to create optimized and organic content for their websites.

Feel free to hit me up in the comments if you'd like to learn more or if you'd know someone who would be into the service I offer.

TIA :)",0,https://www.reddit.com/r/cybersecurity/comments/1dhc3vz/are_there_cyber_security_business_owners_on_this/,14
1718555367.0,Applying Bayesian theorem in Data Retention and destruction. When 100% is far less than one anticipate. ,,2,https://www.certic.info/bayesian_vs_data_retention.php,0
