date,title,content,score,url,num_comments
1718729952.0,Unrestricted Resource Consumption in a Password Reset Vulnerability Case Study,,1,https://devsec-blog.com/2024/06/unrestricted-resource-consumption-in-a-password-reset-web-api-security-champion-part-iv/,0
1718729359.0,OpenSSF's Siren To Warn About OSS Vulnerabilities,,1,https://www.i-programmer.info/news/149-security/17268-openssfs-siren-to-warn-about-oss-vulnerabilities.html,0
1718728282.0,Moving to security tech sales. Any parting advice from my Infosec comrades?,I am joining the 'dark side' of Cybersecurity (i.e. technical sales) after 10+ years in Infosec consultancy. Any parting words of advice from my fellow practitioners? What should I avoid while working with end users and their management? Can you describe the perfect tech sales unicorn you'd love to work with and wouldn't want to block or ignore forever?,1,https://www.reddit.com/r/cybersecurity/comments/1diuy1w/moving_to_security_tech_sales_any_parting_advice/,0
1718727817.0,Is this possible to get job using udemy certificate ,"Hi guys i recently completed my course in online about Ethical hacking is this possible to get job using udemy certificate????
",1,https://www.reddit.com/r/cybersecurity/comments/1diur6d/is_this_possible_to_get_job_using_udemy/,2
1718727118.0,Interview for class project,As the title says I’m looking for someone in the IT security analyst or cybersecurity analyst field (5+ years) to do a class informational interview project on! Your help would be greatly appreciated.,1,https://www.reddit.com/r/cybersecurity/comments/1diuh2z/interview_for_class_project/,0
1718728062.0,Is there a way to copy a machine for malware analysis? ,"Hi there I’m not sure if this is the right sub for this, but I want to know if there is a way to make a copy of a machine that has been infected with malware for malware analysis? I’m been interested is the digital forensics side of cybersecurity, and I wanted to dive deeper into this topic. I’ve done something similar for a project is college, but we made a copy of a USB drive.",1,https://www.reddit.com/r/cybersecurity/comments/1diuutc/is_there_a_way_to_copy_a_machine_for_malware/,4
1718727881.0,SIEM and EDR,"Let's say you have both EDR and SIEM in your organization. How much sense does it make to monitor your server with the EDR and also send system logs to the SIEM? Can we say that EDR makes tools like osquery, Sysmon, and basic system logs redundant, or are there other use cases that make them still relevant from a security point of view? Ignore compliance-related requirements for monitoring reports; focus just on attack detection.",2,https://www.reddit.com/r/cybersecurity/comments/1dius37/siem_and_edr/,2
1718727245.0,ETW logs validation,"Working on validating that all event IDs requested by PA XDR agent are being collected on all our windows devices. Standard event logging logs we need seem to be easy enough to validate by looking at our advanced audit config GPO but I don't understand how to determine if ETW logs are enabled/being collected across our enterprise.

Is there a good way to validate what ETW logs are being collected?",3,https://www.reddit.com/r/cybersecurity/comments/1diuizw/etw_logs_validation/,0
1718724524.0,How Discord Built `Access!` - An Authorization Management Portal,,2,https://www.permit.io/blog/how-discord-built-access-an-authorization-management-portal,0
1718723600.0,Cleveland City Hall again closed today because of ransomware attack,,9,https://www.cleveland.com/cityhall/2024/06/cleveland-city-hall-again-closed-today-because-of-ransomware-attack.html,0
1718723225.0,"Bug Bounty Programs, Hacking Contests Power China's Cyber Offense",,2,https://www.darkreading.com/cybersecurity-operations/bug-bounty-programs-hacking-contests-power-chinas-cyber-offense,0
1718660646.0,Okta Paying $60M Over Their Security Scandal,"Hey guys, if you were an investor in Okta back in 2021 (or you just monitor the news), you must have heard about this scandal.

That's the short story for the newbies: in 2022, the hacker group LAPSUS$ shared screenshots on Telegram, showing they had accessed Okta's internal data.

After that, Okta denied all that and stated that it was just “unsuccessful attempt”. But only a few days later, Todd McKinnon (CEO) confirmed the breach on his Twitter.

After all that, not only direct customers were hurt, but their investors as well (obviously). And now they decided to resolve it with investors at least by paying $60M.

So, if you were an investor back then, you can check if you're eligible and file for the [payment here](https://11thestate.com/cases/okta-investor-settlement).

Anyway, do you think it's a fair sum for them? Or I suppose all scandals can be solved through the Twitter these days",1,https://www.reddit.com/r/cybersecurity/comments/1di9wtk/okta_paying_60m_over_their_security_scandal/,0
1718661778.0,Is it worth it to look for internships in the field post grad?,I’ve still been in the process of looking for jobs in IT or cybersecurity and I’m wondering if it’s worth it to get a paid internship to get the experience? Internships do make me a little iffy because I could do one for a while and not receive an offer. I’m unsure if I should keep looking into them. Any advice?,0,https://www.reddit.com/r/cybersecurity/comments/1diacpn/is_it_worth_it_to_look_for_internships_in_the/,4
1718668325.0,DNS queries resolving to Russian-hosted CDNs,"I'm based in the UK and using ControlD as a DNS filtering system. I have a simple config, and one of the rules is in large terms ""block domains that resolve to IPs belonging to Russia"".

Starting yesterday I noticed large portions of the Internet not working correctly for me - such as LinkedIn, the CDN of SkyNews, some O365 and even some Apple services. After lots of digging I noticed they're all blocked by ControlD's policy I've set as resolving to RU. It can't be I said - must be a glitch with Control D.

Top domains include some concerning ones:

* r3.o.lencr.org
* \*.dscq.akami.net
* apps.identrust.com
* amp-api-edge.apps.apple.com
* gspe19-2-ssl.ls.apple.com
* ced.sascdn.com
* ctldl.windowsupdate.com
* identity.nel.measure.office.net
* static.licdn.com
* statics.teams.cdn.office.net and many others.

Running a quick dig and traceroute most of this traffic is actually resolving via Google DNS, Cloudflare and a few others to IP addresses hosted by Rostelecom. Requests seem to be  resolved by CDNs with a preference for Russia for a number of CDNs and I can't think of a good reason for this. I have reached to Control D user community for initial sanity check and I have found a few other users reporting the same behaviour.

I initially suspected Akamai moved some blocks of IPs from Russia to EU and geo-location was not updated - which does happen every once in a while - but I can actually see BGP routing still advertising the Rostelecom AS numbers for a number of these addresses.

For reference this is one ""landing"" IP range - [https://bgp.tools/prefix/2.16.53.0/24](https://bgp.tools/prefix/2.16.53.0/24)

Any thoughts / investigations you can run in parallel would be greatly appreciated.",1,https://www.reddit.com/r/cybersecurity/comments/1dicrpf/dns_queries_resolving_to_russianhosted_cdns/,1
1718679587.0,How to study GRC?,"Hi everyone :) I noticed more popular roles like in blue & red teaming for example have various roadmaps out there, along with project ideas. The stepping stones you need to do are clearly laid out. 

But that's not the case for GRC, so I've come here. How would one learn GRC exactly?

- Is it a good place to start with common security frameworks and standards (NIST, CIS, etc.), and where do you go after this? 
- What are some beginner GRC projects?

Thank you for your time!

",0,https://www.reddit.com/r/cybersecurity/comments/1dighuz/how_to_study_grc/,2
1718681587.0,Yet another question about Master's Degree,"I know this topic is saturated, I do feel like mine is a bit unique compared to others, but I'm sure everyone feels that way. Apologies for the long post; TLDR: active duty officer, looking good/efficient. route to become fortune 500 CIO in future

I'm currently an active duty Naval Officer, working as the lead cyber security assessor and department head, which conducts cybersecurity training and assessments on Navy commands. My long term goal is to become a fortune 500 CIO and though I think that's an achievable goal, I know that will take some time. Additionally, I will be separating next year because I believe it would be beneficial for my goal to get civilian experience after 10 years of service.

My short term goal is make efficient use of my next few years to set me up correctly for my long term goal. This includes utilizing my GI bill to obtains a masters (I'm an academic at heart and would love a PhD, or doctorate, but I don't believe this field has any desire for that), and applying to a job that lines up well with future goal. My choices are [SANS.edu](http://SANS.edu) masters or some well established cyber masters program like UC Berkeley, but I open to any path that I haven't considered. I'd like to pursue a masters because it's basically a ""free"" post-graduate degree, and the I believe I can balance the work load.

My concerns (I'll start with the bad since I'm nervous about the future, but hopefully it's not as bad as I think):

- Being a naval officer, I haven't been technical since college. While I understand the concepts, I'm no where near as good at programming, and project management as I was 10 years ago. I'm afraid my lack of expertise will be a deterrent for fortune 500 companies.

- The Navy, and DOD network (DISA), is very different than civilian networks. I pray this isn't too big of a gap between civilian networks and deters employers from wanting to hire me.

- If I were to stay in, theoretically, I'd be looking at around 170k where I live (Southern California), and I'd like to make around that. I wouldn't mind taking a pay cut while I'm learning the nuances of the new industry, but I'm very uneducated about this aspect.

My redeeming features (lol):

- I have a lot of leadership experience, and regularly act as an intermediary between technical and executive teams. (Lots of experience from Cyber Assessments and previous job)

- I have a bachelors in Applied Physics and Computer Science, so I would actually be pretty happy if I had the opportunity to be hands on, even just as an intermediary immersion experience in the new industry.

- While DoDIN networks are different, I'm familiar with the non-vendor specific cyber security concepts from my certs like CISSP, PenTest, and PMP.

- If I decide to work for a company that would like me to have a higher degree, I have the GI bill in my back pocket which (maybe?) is an incentive to higher me.

Regarding my connudrum of which program I should look into, I'm worried if a place like UC Berkeley would even want me. I had 3.5+ gpa from UCSC, 10 years of experience from the Navy, and a bunch of certs, but I haven't taken the GRE/GMAT. 

Thank you for any advice, I really do appreciate any insight anyone could offer, and definitely open to new routes that I haven't listed.",0,https://www.reddit.com/r/cybersecurity/comments/1dih43h/yet_another_question_about_masters_degree/,2
1718682528.0,How is the US cybersecurity job market for Immigrants?,"I am originally from the Philippines and have recently moved to USA (California). Now, I intend to hunt for a SOC or Cybersec Engineer job. I have 8 years of experience in the IT industry: 5 years in IT support with mixed of NetAd, and 3 years specifically in Cybersecurity, all gained while living in the Philippines. I hold a bachelor's degree in Information Technology. Is there a posible to get hired?



Thank you for your advice!",1,https://www.reddit.com/r/cybersecurity/comments/1dihe2l/how_is_the_us_cybersecurity_job_market_for/,2
1718682950.0,Got an Interview Call for SAP Cyber Security Analyst Role - Need Advice!,"Hi everyone,



I've recently received an interview call for a **SAP Cyber Security Analyst** role, and I'm looking for some insights. I would appreciate any advice on the following:



**Interview Questions:** What kind of questions should I expect during the interview? Are there specific areas of SAP or cybersecurity that I should focus on while preparing?



**Daily Responsibilities:** What does a typical workday look like for an SAP Cyber Security Analyst? What are the main tasks and responsibilities involved in this role?



Any tips or personal experiences would be really helpful. Thanks in advance!",1,https://www.reddit.com/r/cybersecurity/comments/1dihihz/got_an_interview_call_for_sap_cyber_security/,1
1718687088.0,Advanced DF training/resources,"Hi everyone,

As the title suggests, I have a basic understanding of digital forensics methodology and tools, but I’m looking for advanced training or resources (free or affordable). 

Thanks in advance 🙏",0,https://www.reddit.com/r/cybersecurity/comments/1diip8r/advanced_df_trainingresources/,4
1718693639.0,Security Signatures - OSINT,"Hello all, this question might sound amature so please pardon me. I am a newbie in Cyber Security. I am playing around with some OSINT tools and wanted to ask where I might be able to find some detection signatures (at least basic ones) for some widely used applications. Please guide. Thank you ",0,https://www.reddit.com/r/cybersecurity/comments/1dikcbz/security_signatures_osint/,0
1718707370.0,How do you all stop thinking about work and start studying the important knowledge?,"Every time I want to study, I end up working on my work projects. How do you tell yourself that you should study things outside work?",0,https://www.reddit.com/r/cybersecurity/comments/1dinlql/how_do_you_all_stop_thinking_about_work_and_start/,7
1718713173.0,Obfuscated HTML/JS Code,"I am doing this challenge and I am currently stuck. So it is an HTML file with <p> elements that are obfuscated 

`<p class=""text"" id = ""VVZOIIYTgivura"" style=""font-style: none; font-color: 4px;  width:10px; height:10px; overflow:hidden;"">MSRSLws9N ScFZ CEOcEFjCyw lCW 8RNTU7W2 opSD USJE wzLhw/U3NsaF U9IAFkX3YHNC QdakJudjw XbWlIJQY 4DywrFT ZCNDQ 8OSU+C SocfkV4OVoqB yckOhx qHQw 5In4NKB MSIVMyI RkaM2FBeFM rTD43FDsW Oj4 mUi03HBcLOk RxY gF4EDYlPQA kcicnCQdEOTI rMBZiMD gjIiZbakh2EX gkDzYBJz gnHGo1DTc3 Nxg5 alN4 GXMjLQY/IAZj PDIWC WobKDM7Nn kTOgMA JEB/V3g /Wi4DIXE8H zpyV WNUago3MBd 4CzdsahQlIA VyU XYeLSwbLF9x Ii0APDca YVM lGCEuH2V AOzQhFSImUmN CZl x9YERkBjo naBsub0owGj oaPTAWMQ U7JQsdJCYaLB 8eAys2W GZFeHF vTi UwAiY QIkw8 Iw45 X3E1K QYraAkzAzoFO yMOMQ09f jBfO TsENR YkADElEix PYX1qU j4rGCZOdA 0oMhYxATIlI R0kfRBuAD8AL icINAs0O Txf eHBINBoyGDB/ WGlSY3R qUiI3ASQbIl F6c0poR3Fv b1lqdVQ zEiQN NWI UOQ8 2bG oBJScaIBZ0TC 4jFi0HbnMg Bj4iUmxcc Uc/Jw4TDT8w IR1ie0NkXHF HPycODBo/eW FZbX BIbE1 xR3hlRigDIT AlUiQz BSZOdAU2Kw4 IAy EwJQFoch4iHy MJZWAfIBY 2NC0R d3VDJB YiKDk2G 3BLeHZqXXRuR ywRPAk7NkRk TTc4Pkx2fQ4s ATtSf 3la PA0wJC UXJCZ GIR wyFXYrFD YHIRkcP wZyV WMXOQ8tLx 82Fn0zJxYzfA EtHTMeEBY3 FEJ4 cTwfOmlI Pg==</p>`

 and then at the bottom there are obfuscated JS scripts that are referring to these <p> elements so the one referring to the above <p> is this one 

`<script>`

`if (!k){ for( var k=0; k<1;k++){;}}`

  `lbrVjlGwo = ""pdh""+[].join("""") + ""mNfugcyGNx"";`

`UJNWLSHSVV[lbrVjlGwo]('YTgivura',rZaWht)`

`</script>`

I am unable to deobfuscate the code, even when I run it through a base64 decoder or Ghidra I am not getting much information. where should I go from here? If you have any ideas I am willing to try anything. 

This is the challenge description: 

\* describe how the script was obfuscated

\* what were the goal of each deobfuscated script blocks?

\* include any IOC (Indication of Compromise) found",0,https://www.reddit.com/r/cybersecurity/comments/1dipa8j/obfuscated_htmljs_code/,1
1718714603.0,Interesting Spearphishing Tactic,"Awareness and/or intel request…

We have seen a couple attempts at this now, and I’m curious if others have experienced the same. Phishers are creating a mock email exchange between CEO and CFO outlining a major financial decision. It is formatted perfectly (like a multi- part email thread), and of course includes appropriate names and contact info in footers—it is convincing. The two reach an agreement in the email exchange. Phishers then forward the fake email to a second-tier member of the finance team (Accounts Payable, if possible), spoofing one of the executive’s email accounts, instructing him/her to implement said decision.

Out of curiosity, I used two prompts in ChatGPT last night and created almost the same email, including formatting.

Has anyone else seen this, or is it a very targeted attack against us?",4,https://www.reddit.com/r/cybersecurity/comments/1dipqwi/interesting_spearphishing_tactic/,2
1718716043.0,How much do you willing to spend on courses from cyberinfluencers like Daniel Miessler?,His latest course is 999 usd,0,https://www.reddit.com/r/cybersecurity/comments/1diq8wm/how_much_do_you_willing_to_spend_on_courses_from/,22
1718715203.0,What should I get in cybrary?,"Hey guys I graduated with my associate's in computer networking and I am not yet really good at it but I am still trying to lay some foundational knowledge and I found cybrary give free certs( i know this certs only enhance knowledge or teach you something new real quick) and I was hoping what should I get in cybrary. I am studying to get A+ hopefully but in the meantime, cybrary look good while I'm in chilling after college :\^). ",0,https://www.reddit.com/r/cybersecurity/comments/1dipy6l/what_should_i_get_in_cybrary/,1
1718716104.0,Looking for a few large sample nmap output XMLs to test my new desktop app that allows to query scan results using SQL,I am also looking for beta users to help me test and provide feedback. Currently it is a Mac only desktop app. Please let me know. Thanks in advance. ,1,https://www.reddit.com/r/cybersecurity/comments/1diq9nw/looking_for_a_few_large_sample_nmap_output_xmls/,0
1718716616.0,drzrghfcxzsfgxdhcfgyuftdrsdtfy,"Hi all has anyone come across this www.*.drzrghfcxzsfgxdhcfgyuftdrsdtfy. Com it appears to uses multiple ip address and when blocked on firewalls, seems to still be alerting on .",0,https://www.reddit.com/r/cybersecurity/comments/1diqg5p/drzrghfcxzsfgxdhcfgyuftdrsdtfy/,12
1718712061.0,Maltego (or similar) Experience,"For those of you using maltego, or similar, how are you using it in your role, and what’s the biggest pain points you are experiencing? 
I am considering bringing a link analysis investigation platform into our business, and interested in getting some actual user feedback. 

Use cases: aid SOC, CTI, and possibly Fraud team.",2,https://www.reddit.com/r/cybersecurity/comments/1dioxsp/maltego_or_similar_experience/,1
1718707310.0,"Can weak security be called a ""threat"", or should it be ""vulnerability"" instead?","Hi!

In my college work I have to make a list of threats of a certain environment. Threats, not risks or vulnerabilities. When I google it, it often shows the list of risks or vulnerabilities alongside with threats. For example, weak endpoint security, weak network security, weak passwords.

From the academical perspective, is it wrong if I include them to the list?

edit: rephrasing it because it seemed dumb:   
Is it wrong if I include ""Vulnerabilities in network security"" to the list of Threats?

Many thanks!",29,https://www.reddit.com/r/cybersecurity/comments/1dinl7h/can_weak_security_be_called_a_threat_or_should_it/,38
1718706328.0,New AI deepfake porn bill would require big tech to police and remove images,"Of course
",98,https://www.cnbc.com/2024/06/18/senate-ai-deepfake-porn-bill-big-tech.html,30
1718702647.0,VMware by Broadcom warns of critical vCenter flaws,,16,https://www.theregister.com/2024/06/18/vmware_criticial_vcenter_flaws/,3
1718699510.0,Mentally Simulating IRP/DRP,"Hi guys hope all is well. I am reaching out to Reddit as I cannot get any content on the below on the internet.

I formulated an IRP recently for the company that I work at and the plan has just been approved very recently. But now some of our big partners are asking for our IRP/DRP test results. This is an issue because we have not tested the plan as of yet and you guys know how CEOs feel about stopping operations to test a ""Document"". Can I provide our partners with test results from a Mental Simulated test for the time being until we gather some time to fully test our IRP?

Any advice would be much appreciated.
",1,https://www.reddit.com/r/cybersecurity/comments/1dilpq9/mentally_simulating_irpdrp/,4
1718679496.0,Hack the Hacker - How to Setup an SSH Honeypot,,124,https://blog.sofiane.cc/setup_ssh_honeypot/,15
1718672327.0,"South Korean tech firms form Red, Blue teams to combat AI abuse",,8,https://www.chosun.com/english/industry-en/2024/06/17/FMWXMHXYGVGKZHATIALYNSZLGM/,0
1718671433.0,Seeking SOC management application,"I’m currently engaged in SOC development and am in search for an effective management tool. In the past, I’ve preferred using JIRA or SOAR platforms for case management.

Could anyone recommend any dedicated alternatives specifically tailored to SOC operations?",1,https://www.reddit.com/r/cybersecurity/comments/1diduak/seeking_soc_management_application/,4
1718663991.0,"HIBP Confirms 587,000 Zadig & Voltaire Customers Breached",,14,https://cyberinsider.com/hibp-confirms-587000-zadig-voltaire-customers-breached/,0
1718662112.0,Equifax sells multifactor authentication (MFA) services but it does not offer ability to set up MFA to users of its myequifax website! Insane!,"https://www.equifax.com/resource/-/asset/product-sheet/secure-mfa-digital-transactions/

Anyone who can authenticate using your username and password has access to virtually all your personal identification information.

This is INSANE!",27,https://www.reddit.com/r/cybersecurity/comments/1diahfx/equifax_sells_multifactor_authentication_mfa/,8
1718657292.0,What is the most misunderstood concept in Cybersecurity?,,90,https://www.reddit.com/r/cybersecurity/comments/1di8kge/what_is_the_most_misunderstood_concept_in/,111
1718656804.0,Has anyone been selected for Jury Duty while working in the CyberSecurity field?,"I got summoned for Jury Duty but didn't get selected to be on the Jury for a criminal trial. I'm almost certain they dismissed me due to my occupation as a cybersecurity analyst since that was one of the only questions they asked me in the courtroom. I'm kinda bummed about not being selected too. Talking to my coworkers in my department, none have ever been selected to be on the Jury despite being summoned a few times.

I was just wondering, is this is an industry norm? That way I could set my expectations next time I get a summons.",0,https://www.reddit.com/r/cybersecurity/comments/1di8dgw/has_anyone_been_selected_for_jury_duty_while/,11
1718656142.0,Dump WhatsApp chat or exfiltrate internal data from any app on Android 12 and 13 using CVE-2024-0044,,2,https://www.mobile-hacker.com/2024/06/17/exfiltrate-sensitive-user-data-from-apps-on-android-12-and-13-using-cve-2024-0044-vulnerability/,0
1718655835.0,High-severity vulnerabilities affect a wide range of Asus router models,,9,https://arstechnica.com/security/2024/06/high-severity-vulnerabilities-affect-a-wide-range-of-asus-router-models/,1
1718655116.0,Should the power remain on during an incident ?,"Hello,

I have an unfinished article I started writing a moment ago, and I wanted to have the opinions of Cyber Security professionals by making a poll and having a percentage of answers for those who agree or not.

Of course I already started answering the question on the article, but wanted to have some statistics with it.

Unfortunately, I couldn't do that on Twitter because I don't have enough people following.

Thank you in advance.

[View Poll](https://www.reddit.com/poll/1di7pch)",2,https://www.reddit.com/r/cybersecurity/comments/1di7pch/should_the_power_remain_on_during_an_incident/,12
